Title,Affiliation,Authors,Coordinates
RHIZOME ARCHITECTURE: An Adaptive Neurobehavioral Control Architecture for Cognitive Mobile Robots—Application in a Vision-Based Indoor Robot Navigation Context,"'Laboratoire Informatique, Image et Interaction (L3i), Computer Science Department, University of La Rochelle, La Rochelle, France'","'Dalia Marcela Rojas-Castro,\xa0Arnaud Revel\xa0&\xa0Michel Menard'","[('', '')]"
A Novel Reinforcement-Based Paradigm for Children to Teach the Humanoid Kaspar Robot,"'School of Computer Science, University of Hertfordshire, Hatfield, UK', 'Institute of Intelligent Systems and Robotics, CNRS, Sorbonne Université, Paris, France', 'School of Electrical and Computer Engineering, National Technical University of Athens, Athens, Greece', 'Departments of Electrical and Computer Engineering/Systems Design Engineering, University of Waterloo, Waterloo, Canada'","'Abolfazl Zaraki,\xa0Luke J. Wood,\xa0Gabriella Lakatos,\xa0Farshid Amirabdollahian,\xa0Ben Robins\xa0&\xa0Kerstin Dautenhahn', 'Mehdi Khamassi', 'Costas Tzafestas', 'Kerstin Dautenhahn'","[(51.75174425, -0.23904979445944738), (48.84804475, 2.346736461375838), (37.98785015, 23.731825812552522), (43.4701994, -80.54524293779451)]"
ENRICHME: Perception and Interaction of an Assistive Robot for the Elderly at Home,"'University of Lincoln, Lincoln, UK', 'ENSTA-ParisTech, Palaiseau, France', 'PAL Robotics, Barcelona, Spain', 'Université de Sherbrooke, Sherbrooke, Canada', 'School of Information Science and Technology, University of Science and Technology of China, 443 Huangshan Road, Hefei, 230027, China'","'Serhan Coşar,\xa0Manuel Fernandez-Carmona,\xa0Shigang Yue\xa0&\xa0Nicola Bellotto', 'Roxana Agrigoroaie\xa0&\xa0Adriana Tapus', 'Jordi Pages', 'François Ferland', 'Feng Zhao'","[(53.2281087, -0.5469923), (48.70860405, 2.221735389647204), (41.3828939, 2.1774322), (45.37796365, -71.92746417605778), (31.8403891, 117.2501941133908)]"
TROS: Protecting Humanoids ROS from Privileged Attackers,"'Department of Engineering, University of Naples Parthenope, Centro Direzionale, Isola C4, Naples, Italy', 'Department of Physics, University of Naples Federico II, Naples, Italy'","'Giovanni Mazzeo', 'Mariacarla Staffa'","[(40.856260500000005, 14.283361626523682), ('', '')]"
Multimodal Object-Based Environment Representation for Assistive Robotics,"'Laboratory of Informatics, Robotics and MicroElectronics, University of Montpellier, 161 rue Ada, 34095, Montpellier, France'",'Yohan Breux\xa0&\xa0Sebastien Druon',"[('', '')]"
Children Teach Handwriting to a Social Robot with Different Learning Competencies,"'CHILI Lab, Ecole Polytechnique Fédérale de Lausanne, EPFL-CHILI, RLC D1 740 (Rolex Learning Center), Station 20, CH-1015, Lausanne, Switzerland', 'INESC-ID, GAIPS Lab, Instituto Superior Técnico, University of Lisbon, IST Taguspark, Av. Prof. Doutor Aníbal Cavaco Silva, 2744-016, Porto Salvo, Portugal'","'Shruti Chandra\xa0&\xa0Pierre Dillenbourg', 'Shruti Chandra\xa0&\xa0Ana Paiva'","[(46.518659400000004, 6.566561505148001), ('', '')]"
A Holistic Approach to Behavior Adaptation for Socially Assistive Robots,"'CNR – Italian National Research Council, ISTC – Institute of Cognitive Sciences and Technologies, Via S. Martino della Battaglia 44, 00185, Rome, Italy'","'Alessandro Umbrico,\xa0Amedeo Cesta,\xa0Gabriella Cortellessa\xa0&\xa0Andrea Orlandini'","[(41.9058706, 12.5046685)]"
Reinforcement Learning Aided Robot-Assisted Navigation: A Utility and RRT Two-Stage Approach,"'Department of Electrical and Computer Engineering, Institute of Systems and Robotics, University of Coimbra, Coimbra, Portugal'","'Luís Garrote,\xa0João Paulo\xa0&\xa0Urbano J. Nunes'","[(40.20727145, -8.425504708876376)]"
Social Media in Human–Robot Interaction,"'School of Professional Communication, Ryerson University, 350 Victoria Street, Toronto, ON, Canada', 'McMaster University, 1280 Main Street West, Hamilton, ON, Canada', 'Toronto, ON, Canada'","'Frauke Zeller\xa0&\xa0Jacky Au Duong', 'David Harris Smith', 'Alanna Mager'","[(43.657908000000006, -79.38055098683543), (43.263939699999995, -79.917825231868), (43.6534817, -79.3839347)]"
ZORA Robot Based Interventions to Achieve Therapeutic and Educational Goals in Children with Severe Physical Disabilities,"'Department of Health, Research Centre for Assistive Technology in Care, Zuyd University of Applied Sciences, Heerlen, The Netherlands', 'Department of Health Services Research, CAPHRI, Care and Public Health Research Institute, Maastricht University, Maastricht, The Netherlands', 'School of Health and Related Research, Centre for Assistive Technology and Connected Healthcare, University of Sheffield, Sheffield, UK'","'Renée J. F. van den Heuvel\xa0&\xa0Monique A. S. Lexis', 'Renée J. F. van den Heuvel\xa0&\xa0Luc P. de Witte', 'Luc P. de Witte'","[(50.8775239, 5.981506585454879), (50.8499111, 5.6856029), (53.3815369, -1.4806342198324056)]"
Child–Robot Relationship Formation: A Narrative Review of Empirical Research,"'Amsterdam School of Communication Research (ASCoR), University of Amsterdam, P.O. Box 1579, 1001 NG, Amsterdam, The Netherlands'","'Caroline L. van Straten,\xa0Jochen Peter\xa0&\xa0Rinaldo Kühne'","[('', '')]"
Robot Semantic Protocol (RoboSemProc) for Semantic Environment Description and Human–Robot Communication,"'Institute of Real-time Learning Systems, University of Siegen, Hőlderlinstr.3, 57076, Siegen, Germany', 'Institute of Knowledge Based Systems and Knowledge Management, University of Siegen, Hőlderlinstr.3, 57076, Siegen, Germany'","'Nazeer T. Mohammed Saeed,\xa0Masoud Fathi\xa0Kazerouni\xa0&\xa0Klaus-Dieter Kuhnert', 'Madjid Fathi'","[(50.9065497, 8.0281077), (50.9065497, 8.0281077)]"
The Challenges of Designing a Robot for a Satisfaction Survey: Surveying Humans Using a Social Robot,"'School of Information Technology and Electrical Engineering, The University of Queensland, Brisbane, Australia'","'Scott Heath,\xa0Jacki Liddle\xa0&\xa0Janet Wiles'","[(-27.49741805, 153.01316955983583)]"
Interactive Natural Motion Planning for Robot Systems Based on Representation Space,"'Department of Automation, Shanghai Jiao Tong University, Shanghai, 200240, People’s Republic of China'",'Guofei Xiang\xa0&\xa0Jianbo Su',"[(31.02755475, 121.4323083995197)]"
Theory of Mind in Social Robots: Replication of Five Established Human Tests,"'College of Media & Communication, Texas Tech University, Box 43082, Lubbock, TX, 79409, USA'",'Jaime Banks',"[(33.59375255, -101.89959552302756)]"
Who is Willing to Help Robots? A User Study on Collaboration Attitude,"'Sapienza University of Rome, Via Ariosto 25, 00185, Rome, Italy'","'Andrea Vanzo,\xa0Francesco Riccio,\xa0Mahmoud Sharf,\xa0Valeria Mirabella,\xa0Tiziana Catarci\xa0&\xa0Daniele Nardi'","[(41.8905837, 12.5040396)]"
Sign Recognition System for an Assistive Robot Sign Tutor for Children,"'Faculty of Computer and Informatics, Istanbul Technical University, Istanbul, Turkey', 'Faculty of Engineering and Technology, Galatasaray University, Istanbul, Turkey', 'School of Science and Technology, Örebro University, SE-701 82, Örebro, Sweden'","'Cemal Gürpınar,\xa0Pınar Uluer\xa0&\xa0Hatice Köse', 'Pınar Uluer', 'Neziha Akalın'","[(41.10504645, 29.02632676574676), (41.045992299999995, 29.020462428881267), (58.0860664, 15.2779002)]"
A Preliminary Study of Interactive Navigation Framework with Situation-Adaptive Multimodal Inducement: Pass-By Scenario,"'Research Institute for Science and Engineering (RISE), Waseda University, 17 Kikui-cho, Shinjuku-ku, Tokyo, 162-0044, Japan', 'Department of Modern Mechanical Engineering, School of Creative Science and Engineering, Waseda University, 3-4-1 Okubo, Shinjuku-ku, Tokyo, 169-8555, Japan', 'PRESTO, Japan Science and Technology Agency (JST), 4-1-8 Honcho, Kawaguchi, Saitama, 332-0012, Japan'","'Mitsuhiro Kamezaki', 'Ayano Kobayashi,\xa0Yuta Yokoyama,\xa0Hayato Yanagawa,\xa0Moondeep Shrestha\xa0&\xa0Shigeki Sugano', 'Mitsuhiro Kamezaki'","[(35.709179750000004, 139.71972128895072), ('', ''), (35.8078228, 139.7241054)]"
Robot–City Interaction: Mapping the Research Landscape—A Survey of the Interactions Between Robots and Modern Cities,"'Faculty of Computer Science, Vrije Universiteit Amsterdam, De Boelelaan 1081-1089, 1081 HV, Amsterdam, The Netherlands', 'School of Mathematical and Computer Sciences, Currie, Edinburgh, EH14 4A, UK', 'Knowledge Media Institute, The Open University, Walton Hall, Milton Keynes, MK7 6AA, UK', 'Insight Centre for Data Analytics, The DERI Building, IDA Business Park, Lower Dangan, Galway, Ireland'","'Ilaria Tiddi', 'Emanuele Bastianelli', 'Enrico Daga\xa0&\xa0Enrico Motta', 'Mathieu d’Aquin'","[(52.33396225, 4.865196500737312), ('', ''), (52.02453775, -0.7092748093945007), ('', '')]"
Constructing the Meaning of Humanoid Sex Robots,"'University of Virginia, Charlottesville, USA', 'University of Bergamo, Bergamo, Italy'","'Deborah G. Johnson', 'Mario Verdicchio'","[(38.0410576, -78.50549960183568), ('', '')]"
Design and Validation of MOMDP Models for Child–Robot Interaction Within Tasks of Robot-Assisted ASD Diagnostic Protocol,"'Laboratory for Robotics and Intelligent Control Systems, University of Zagreb, Faculty of Electrical Engineering and Computing, Unska 3, Zagreb, Croatia'",'Frano Petric\xa0&\xa0Zdenko Kovacic',"[(45.8007525, 15.971296747620734)]"
"Gathering Expert Opinions for Social Robots’ Ethical, Legal, and Societal Concerns: Findings from Four International Workshops","'eLaw Center for Law and Digital Technologies, Leiden University, Steenschuur 25, 2311 ES, Leiden, The Netherlands', 'Nordic Centre for Internet and Society, Department of Communication and Culture, BI Norwegian Business School, Nydalsveien 37, 0484, Oslo, Norway', 'Center for Information Technology, Society, and Law (ITSL), University of Zurich, Rämistrasse 74/57, 8001, Zurich, Switzerland'","'Eduard Fosch-Villaronga', 'Christoph Lutz', 'Aurelia Tamò-Larrieux'","[(52.1561872, 4.4898692), (59.94887, 10.768207), (14.4663168, 121.0284561)]"
Human–Robot Interaction Analysis for a Smart Walker for Elderly: The ACANTO Interactive Guidance System,"'Department of Engineering and Computer Science, University of Trento, Trento, Italy', 'Department of Industrial Engineering, University of Trento, Trento, Italy'","'Francesco Ferrari,\xa0Stefano Divan,\xa0Cristina Guerrero,\xa0Fabiano Zenatti,\xa0Roberta Guidolin\xa0&\xa0Luigi Palopoli', 'Daniele Fontanelli'","[(46.0661497, 11.11662318758863), (46.0661497, 11.11662318758863)]"
Introducing the Social Robot MARIO to People Living with Dementia in Long Term Residential Care: Reflections,"'School of Nursing and Midwifery, National University of Ireland, Galway, Ireland', 'Centre for Bioethical Research and Analysis (COBRA), School of Philosophy, National University of Ireland, Galway, Ireland', 'Loretto Heights School of Nursing, Regis University, Denver, CO, USA'","'Arlene Mannion,\xa0Sarah Summerville,\xa0Eva Barrett,\xa0Megan Burke,\xa0Adam Santorelli,\xa0Tanja Kovacic,\xa0Kathy Murphy,\xa0Dympna Casey\xa0&\xa0Sally Whelan', 'Heike Felzmann', 'Cheryl Kruschke'","[('', ''), ('', ''), (39.789711100000005, -105.03136946717461)]"
Towards a Theory of Longitudinal Trust Calibration in Human–Robot Teams,"'Warfighter Effectiveness Research Center, United States Air Force Academy, 2354 Fairchild Drive Suite 5L-50, Colorado Springs, CO, 80840, USA', 'Department of Psychology, Clemson University, 418 Brackett Hall, Clemson, SC, 29634, USA', 'George Mason University, 4400 University Drive 3F5, Fairfax, VA, 22030, USA', 'TNO, Perceptual and Cognitive Systems, Kampweg 55, 3769, DE Soesterberg, The Netherlands', 'Delft University of Technology, Delft, The Netherlands', 'Department of Information Science, Cornell University, Gates Hall, 220A, Ithaca, NY, 14853, USA'","'Ewart J. de Visser', 'Richard Pak', 'Spencer Kohn\xa0&\xa0Tyler H. Shaw', 'Marieke M. M. Peeters\xa0&\xa0Mark A. Neerincx', 'Mark A. Neerincx', 'Malte F. Jung'","[(38.8339578, -104.825348), (34.66869155, -82.83743475607795), (38.83133325, -77.30798838879116), (52.1154136, 5.2904132), (51.99882735, 4.373960368154041), (42.4396039, -76.4968019)]"
"Looking Beyond Collaboration: Socioemotional Positive, Negative and Task-Oriented Behaviors in Human–Robot Group Interactions","'ISCTE-Instituto Universitário de Lisboa (ISCTE-IUL), CIS-IUL and INESC-ID, Lisbon, Portugal', 'ISCTE-Instituto Universitário de Lisboa (ISCTE-IUL) and CIS-IUL, Lisbon, Portugal', 'Instituto Superior Técnico-Universidade de Lisboa and INESC-ID, Lisbon, Portugal'","'Raquel Oliveira', 'Patrícia Arriaga', 'Filipa Correia\xa0&\xa0Ana Paiva'","[(38.7077507, -9.1365919), (38.7077507, -9.1365919), (38.7077507, -9.1365919)]"
Human-Like Guide Robot that Proactively Explains Exhibits,"'University of Tsukuba/JST PRESTO, 1-1-1 Tennodai, Tsukuba, Ibaraki, Japan', 'Intelligent Robotics and Communication Labs., ATR, 2-2-2 Hikaridai Keihanna-Sci. City, Kyoto, Japan', 'Kyoto University, Yoshida-honmachi, Sakyo-ku, Kyoto, Japan', 'Toyohashi University of Technology, 1-1 Hibarigaoka, Tempaku-cho, Toyohashi, Aichi, Japan'","'Takamasa Iio', 'Satoru Satake,\xa0Florent Ferreri\xa0&\xa0Norihiro Hagita', 'Takayuki Kanda', 'Kotaro Hayashi'","[(36.0833265, 140.077279), (34.7445855, 135.7654296), (35.0268953, 135.7815031), (34.70120265, 137.4082027821915)]"
Correlation Analysis for Predictive Models of Robot User’s Impression: A Study on Visual Medium and Mechanical Noise,"'Tokyo University of Agriculture and Technology, 2-24-16 Nakacho, Koganei, Tokyo, Japan'",'Takamune Izui\xa0&\xa0Gentiane Venture',"[(35.699409, 139.51843965481308)]"
Correction to: Editorial,"'Social Cognition in Human-Robot Interaction, Istituto Italiano Di Tecnologia, Genoa, Italy', 'Social Robotics Laboratory, Interactive Digital Media Institute, The National University of Singapore, Singapore, Singapore', 'Centre for Robotics, UESTC, Chengdu, China', 'Robotics Laboratory, Department of Computer Science, Stanford University, Stanford, CA, USA'","'Agnieszka Wykowska', 'Shuzhi Sam Ge', 'Shuzhi Sam Ge', 'Oussama Khatib'","[(44.475016499999995, 8.906361822677376), ('', ''), (30.7367729, 103.97192673898282), (37.431313849999995, -122.16936535498309)]"
Editorial,"'Social Cognition in Human-Robot Interaction, Istituto Italiano Di Tecnologia, Genoa, Italy', 'Social Robotics Laboratory, Interactive Digital Media Institute, The National University of Singapore, Singapore, Singapore', 'Centre for Robotics, UESTC, Chengdu, China', 'Robotics Laboratory, Department of Computer Science, Stanford University, Stanford, CA, USA'","'Agnieszka Wykowska', 'Shuzhi Sam Ge', 'Shuzhi Sam Ge', 'Oussama Khatib'","[(44.475016499999995, 8.906361822677376), ('', ''), (30.7367729, 103.97192673898282), (37.431313849999995, -122.16936535498309)]"
Exploring University Students’ Preferences for Educational Robot Design by Means of a User-Centered Design Approach,"'Applied Social Psychology and Gender Research, CITEC, Bielefeld University, Inspiration 1, 33619, Bielefeld, Germany', 'Department of Psychology, Bielefeld University, Bielefeld, Germany'","'Natalia Reich-Stiebert\xa0&\xa0Friederike Eyssel', 'Charlotte Hohnemann'","[(52.0454055, 8.492327704328025), (52.0376885, 8.493223283579532)]"
A Feasibility Study of a Social Robot Collecting Patient Reported Outcome Measurements from Older Adults,"'Department of Geriatric Medicine, Donders Institute for Brain, Cognition and Behaviour, Radboud University Medical Center, Nijmegen, The Netherlands', 'Faculty of Electrical Engineering, Mathematics and Computer Science, Delft University of Technology, Delft, The Netherlands', 'Radboud Alzheimer Centre, Radboud University Medical Center, Nijmegen, The Netherlands'","'Roel Boumans,\xa0Fokke van Meulen\xa0&\xa0Marcel Olde Rikkert', 'Roel Boumans,\xa0Koen Hindriks\xa0&\xa0Mark Neerincx', 'Marcel Olde Rikkert'","[(51.82629075, 5.863270064963448), (51.99882735, 4.373960368154041), (51.842574850000005, 5.838960628748229)]"
The Humanoid Robot NAO as Trainer in a Memory Program for Elderly People with Mild Cognitive Impairment,"'Department of Medicine and Surgery, University of Parma, Parma, Italy', 'Institut des Systmes Intelligents et de Robotique, CNRS UMR7222, Sorbonne Université, Paris, France', 'Department of Computer Science, Universiy of Bari, Bari, Italy'","'Olimpia Pino\xa0&\xa0Rosalinda Trevino', 'Giuseppe Palestra', 'Berardina De Carolis'","[('', ''), (48.8497017, 2.383823836078686), (41.1257843, 16.8620293)]"
Reactive Chameleon: A Method to Mimic Conversation Partner’s Body Sway for a Robot,"'Keio University, Hiyoshi, Kohoku-ku, Yokohama-shi, Kanagawa-ken, 223-8522, Japan', 'Honda Research Institute Japan Co., Ltd., Honcho, Wako-shi, Saitama, 351-0188, Japan'","'Ryosuke Hasumoto\xa0&\xa0Michita Imai', 'Kazuhiro Nakadai'","[(35.552084050000005, 139.6495837941362), (35.7817053, 139.6058692)]"
Peers’ Experience Learning for Developmental Robots,"'Air Force Engineering University, No. 1 Baling Road, Baqiao District, Xi’an City, Shaanxi Province, China'","'Ruixuan Wei,\xa0Qirui Zhang\xa0&\xa0Zhuofan Xu'","[('', '')]"
Geometric Intuitive Techniques for Human Machine Interaction in Medical Robotics,"'Department of Electrical Engineering and Computer Science, CINVESTAV, Campus Guadalajara, Av. del Bosque 1145, El Bajio, 45019, Zapopan, Jalisco, Mexico', 'CINVESTAV, Campus Guadalajara, Zapopan, Mexico'","'Eduardo Bayro-Corrochano', 'Ana M. Garza-Burgos\xa0&\xa0Juan L. Del-Valle-Padilla'","[(20.6675871, -103.46446838741106), (20.7347699, -103.45507909147551)]"
Why Do Robots Need a Head? The Role of Social Interfaces on Service Robots,"'Trinity College Dublin, Dublin, Ireland'",'Conor McGinn',"[(53.34366745, -6.254444724511822)]"
Can Human-Inspired Learning Behaviour Facilitate Human–Robot Interaction?,"'Department of Informatics, Bioengineering, Robotics and Systems Engineering, University of Genoa, Via Opera Pia 13, 16145, Genoa, Italy'","'Alessandro Carfì,\xa0Jessica Villalobos,\xa0Enrique Coronado,\xa0Barbara Bruno\xa0&\xa0Fulvio Mastrogiovanni'","[('', '')]"
Can We Keep Him Forever? Teens’ Engagement and Desire for Emotional Connection with a Social Robot,"'University of Washington, Seattle, USA', 'University of Washington Tacoma, Tacoma, USA'","'Elin A. Björling,\xa0Andrew Davidson,\xa0Rachel Ren\xa0&\xa0Dorothy Wong', 'Emma Rose'","[(47.6543466, -122.30806059473039), (47.245217499999995, -122.43981965250066)]"
Social Activity Recognition on Continuous RGB-D Video Sequences,"'Queen Mary University of London, Mile End Road, London, England, E1 4NS, UK', 'University of Lincoln, Brayford Pool, Lincoln, England, LN6 7TS, UK', 'Aston University, Aston Express Way, Birmingham, England, B4 7ET, UK'","'Claudio Coppola', 'Serhan Cosar\xa0&\xa0Nicola Bellotto', 'Diego R. Faria'","[(51.5247272, -0.03931034663016243), (53.2288715, -0.5462842941082742), (52.48620785, -1.888499150885147)]"
An Affordance and Distance Minimization Based Method for Computing Object Orientations for Robot Human Handovers,"'Department of Mechanical Engineering, University of British Columbia, Vancouver, BC, Canada', 'Disney Research, Los Angeles, CA, USA', 'Faculty of Engineering, Monash University, Melbourne, VIC, Australia', 'Department of Information Science and Technology, University of Tokyo, Tokyo, Japan'","'Wesley P. Chan', 'Matthew K. X. J. Pan', 'Elizabeth A. Croft', 'Masayuki Inaba'","[(49.25783145, -123.24624198622213), (34.0536909, -118.242766), (-37.8774234, 145.04496691740303), (35.71171565, 139.76374569517452)]"
Generalisation of Anthropomorphic Stereotype,"'School of Computing, Electronics, and Mathematics, Plymouth University, Portland Square, Drake Circus, Plymouth, PL4 8AA, UK', 'School of Psychology, Plymouth University, Portland Square, Drake Circus, Plymouth, PL4 8AA, UK'","'Debora Zanatto,\xa0Massimiliano Patacchiola\xa0&\xa0Angelo Cangelosi', 'Jeremy Goslin'","[(50.3744821, -4.1380928), (50.3746438, -4.138895363764046)]"
Learning Proxemics for Personalized Human–Robot Social Interaction,"'School of Information Science, Japan Advanced Institute of Science and Technology, 1-1 Asahidai, Nomi, Ishikawa, Japan', 'Information, Computer, and Communication Technology, Sirindhorn International Institute of Technology, Phahonyothin Rd., Tambon Khlong Nung, Amphoe Khlong Luang, Pathum Thani, Thailand', 'Center for Artificial Intelligence in Medicine, Bio-medical Research Institute, Kyungpook National University Hospital, Daegu, Republic of Korea', 'School of Medicine, Kyungpook National University, Daegu, Republic of Korea'","'Pakpoom Patompak\xa0&\xa0Nak Young Chong', 'Pakpoom Patompak\xa0&\xa0Itthisek Nilkhamhang', 'Sungmoon Jeong', 'Sungmoon Jeong'","[(36.4442949, 136.5928587), ('', ''), (35.86646915, 128.60483363825153), (35.8905697, 128.610855264775)]"
Cognitive Performance and Physiological Response Analysis,"'Autonomous Systems and Robotics Laboratory, U2IS, ENSTA ParisTech, 828 Boulevard des Marechaux, Palaiseau, France'",'Roxana Agrigoroaie\xa0&\xa0Adriana Tapus',"[(48.7105142, 2.2194361)]"
A Robot for Test Bed Aimed at Improving Telepresence System and Evasion from Discomfort Stimuli by Online Learning,"'Keio University, Tokyo, Japan'",'Masahiko Osawa\xa0&\xa0Michita Imai',"[(35.64883905, 139.74277067454523)]"
When Your Robot Avatar Misbehaves You Are Likely to Apologize: An Exploration of Guilt During Robot Embodiment,"'Event LAB, Departament de Psicologia Clínica i Psicobiologia, Facultat de Psicologia, Universitat de Barcelona, Campus de Mundet - Edifici Teatre, Passeig de la Vall d’Hebron 171, 08035, Barcelona, Spain', 'Institut de Neurociències, Universitat de Barcelona, 08035, Barcelona, Spain'","'Laura Aymerich-Franch,\xa0Sameer Kishore\xa0&\xa0Mel Slater', 'Mel Slater'","[(41.3868913, 2.1635238457663224), (41.3868913, 2.1635238457663224)]"
Care Workers’ Readiness for Robotization: Identifying Psychological and Socio-Demographic Determinants,"'Faculty of Social Sciences, Tampere University, Kalevantie 5, 33014, Tampere, Finland', 'Faculty of Humanities and Social Sciences, University of Jyväskylä, Keskussairaalantie 2, 40014, Jyväskylä, Finland', 'Institute of Criminology and Legal Policy Organization, University of Helsinki, Helsinki, Finland'","'Tuuli Turja\xa0&\xa0Atte Oksanen', 'Sakari Taipale', 'Markus Kaakinen'","[(61.49529285, 23.77799830160161), (62.2350957, 25.731085314372155), (60.175648300000006, 24.953550020522073)]"
Multimodal Information Fusion for Automatic Aesthetics Evaluation of Robotic Dance Poses,"'Academy of Arts, Shaoxing University, Shaoxing, 312000, China', 'Department of Computer Science and Engineering, Shaoxing University, Shaoxing, 312000, China', 'College of Information Science and Engineering, Jishou University, Jishou, 416000, China', 'School of Computer Science and Electronic Engineering, University of Essex, Colchester, CO4 3SQ, UK', 'Cognitive Science Department, Xiamen University, Xiamen, 361005, China', 'Department of Computer Science and Technology, Hefei University, Hefei, 230601, China'","'Jing Li', 'Hua Peng', 'Hua Peng', 'Hua Peng\xa0&\xa0Huosheng Hu', 'Zhiming Luo', 'Chao Tang'","[(29.981529199999997, 120.56643645272392), (29.981529199999997, 120.56643645272392), (28.265262, 109.6938658), (51.87703035, 0.9500788585686786), (24.4399419, 118.09301780912739), (31.8438084, 117.2577969)]"
How Does It Feel to Clap Hands with a Robot?,"'Collaborative Robotics and Intelligent Systems Institute, Oregon State University, Corvallis, OR, 97331, USA', 'Haptic Intelligence Department, Max Planck Institute for Intelligent Systems, 70569, Stuttgart, Germany'","'Naomi T. Fitter', 'Katherine J. Kuchenbecker'","[(44.56305595, -123.28392363395751), (48.74302128678389, 9.10988884662507)]"
Toward an Expressive Bipedal Robot: Variable Gait Synthesis and Validation in a Planar Model,"'Department of Mechanical Science and Engineering, University of Illinois at Urbana-Champaign, Champaign, IL, 61801, USA', 'Laban/Bartenieff Institute of Movement Studies (LIMS), Brooklyn, NY, 11217, USA'","'Umer Huzaifa\xa0&\xa0Amy LaViers', 'Catherine Maguire'","[(40.1164841, -88.2430932), (40.6526006, -73.9497211)]"
Editorial,"'Robotics Research Lab, Department of Electrical & Computer Engineering, National University of Singapore, 21 Lower Kent Ridge Road, Singapore, 119077, Singapore', 'Istituto Italiano di Tecnologia, Via Morego, 30, 16163, Genoa, Italy', 'Robotics Laboratory, Department of Computer Science, Stanford University, Stanford, CA, 94305-9010, USA'","'Shuzhi Sam Ge', 'Agnieszka Wykowska', 'Oussama Khatib'","[('', ''), (44.4766657, 8.9076415), (37.431313849999995, -122.16936535498309)]"
A Hybrid Joint/Cartesian DMP-Based Approach for Obstacle Avoidance of Anthropomorphic Assistive Robots,"'Research Unit of Advanced Robotics and Human-Centred Technologies, Università Campus Bio-Medico, via Alvaro del Portillo 21, 00128, Rome, Italy'","'Clemente Lauretti,\xa0Francesca Cordella\xa0&\xa0Loredana Zollo'","[(41.7669299, 12.4697018)]"
Could Social Robots Make Us Kinder or Crueller to Humans and Animals?,"'Computing and Information Systems, Melbourne School of Engineering, The University of Melbourne, Parkville, VIC, 3010, Australia', 'School of Social Sciences, Monash University, Clayton, VIC, 3800, Australia'","'Simon Coghlan,\xa0Frank Vetere\xa0&\xa0Jenny Waycott', 'Barbara Barbosa Neves'","[(-37.7960951, 144.96144589814), (-37.91412095, 145.13167281466212)]"
Culture as a Sensor? A Novel Perspective on Human Activity Recognition,"'Department of Informatics, Bioengineering, Robotics and Systems Engineering, University of Genoa, Via Opera Pia 13, 16145, Genoa, Italy'","'Ting-Chia Chiang,\xa0Barbara Bruno,\xa0Roberto Menicatti,\xa0Carmine Tommaso Recchiuto\xa0&\xa0Antonio Sgorbissa'","[('', '')]"
